Date,Description,Author,Sentiment,Severity,Stock_Price_difference,Stock_Price_Percentage_difference
2024-04-29,"If you've been planning on buying an Apple Watch Series 9, today looks like a decent time to take the plunge. The smartwatch is currently on sale for $299 at multiple retailers, including Amazon, Best Buy, Target and Walmart. That's not quite the lowest price…",Jeff Dunn,Neutral,1,-11.930000000000064,-0.013619498829841958
2024-04-29,"Meta broke its own lobbying record and easily outspent its peers, lobbying on issues including kids online safety, content moderation, competition, and encryption.",Lauren Feiner,Negative,3,-11.930000000000064,-0.013619498829841958
2024-04-29,"With the creators of Fallout enjoying a new surge in players since Amazon Prime’s television series has been a huge… Continue reading Fallout 5 may be released sooner than we all expected
The post Fallout 5 may be released sooner than we all expected appeared…",Sophie Atkinson,Positive,2,-11.930000000000064,-0.013619498829841958
2024-04-29,"For Amazon Gaming Week, there are some Razer Blade discounts on excellent gaming laptops, and these are prices you don't want to miss out on.",Briley Kenney,Positive,2,-11.930000000000064,-0.013619498829841958
2024-04-29,"Fallout is a huge success for Amazon Prime Video, and these three sci-fi shows are the best ones to watch next for more action and adventure.",Joe Allen,Positive,1,-11.930000000000064,-0.013619498829841958
2024-04-26,"According to a court document viewed by Engadget, the Federal Trade Commission accused Amazon of using Signal’s disappearing messages feature to conceal communications as part of its antitrust suit against the company. The FTC says the retailer continued to a…",Will Shanklin,Negative,2,39.3900000000001,0.046994678947242956
2024-04-26,"After an earlier Consumer Reports investigation found security vulnerabilities in Eken cameras, the Chinese company has issued a firmware update.",Amrita Khalid,Neutral,2,39.3900000000001,0.046994678947242956
2024-04-26,"Amazon has some of the highest-rated Bose headphones on sale for record-low prices. That includes the Bose QuietComfort Ultra headphones, which have best-in-class active noise cancellation (ANC). Usually $429, the wireless cans are now only $379, matching an …",Will Shanklin,Positive,2,39.3900000000001,0.046994678947242956
2024-04-26,"Apple's latest MacBook Air with the new M3 chip just hit its lowest price yet at Amazon. The retailer is taking $110 off the laptop's list price, which is $10 cheaper than the sale price of $999 its been hitting lately. That's not a huge difference, but still…",Amy Skorheim,Positive,1,39.3900000000001,0.046994678947242956
2024-04-26,"The Sense 2 is a fantastic workout companion and it's just hit a new low price, making this the perfect time to snag one for yourself.",Max McHone,Positive,1,39.3900000000001,0.046994678947242956
2024-04-25,"Nintendo's top-of-the-line handheld gaming console hardly ever goes on sale, making this small discount super appealing.",Louryn Strampe,Positive,2,88.67000000000007,0.112428361312573
2024-04-25,How did Jeff Bezos's leadership style help Amazon become the global trillion-dollar giant that it is today? A Harvard Professor broke down his thoughts.,Polly Thompson,Positive,2,88.67000000000007,0.112428361312573
2024-04-25,"Conspiracies about outside forces funding and orchestrating the university protests at Columbia and NYU have taken hold online, primarily on X.",David Gilbert,Negative,2,88.67000000000007,0.112428361312573
2024-04-25,"Use Amazon WorkDocs to store, share, and collaborate on files.",,Neutral,1,88.67000000000007,0.112428361312573
2024-04-25,You won't find any violations if you just stop looking,Chris Thomas,Neutral,2,88.67000000000007,0.112428361312573
2024-04-24,Amazfit’s GTR 4 is currently down to $169.99 ($30 off) at multiple retailers. Anker’s Soundcore Sport X10 earbuds and Roborock’s Q Revo robot vacuum are also on sale.,Sheena Vasani,Positive,2,-13.17999999999995,-0.015699821322215545
2024-04-24,[Removed],,"I'm sorry, but I cannot provide sentiment analysis for the news article as the content has been removed.",2,-13.17999999999995,-0.015699821322215545
2024-04-24,"If you’re interested in strategies for scaling start-ups, this episode is for you.",,Positive,1,-13.17999999999995,-0.015699821322215545
2024-04-24,WIRED went along to the company's launch event where customers picked up the very first R1s and learned of an inbound “all-seeing” accompanying AI device.,Julian Chokkattu,Positive,3,-13.17999999999995,-0.015699821322215545
2024-04-24,"After years of delay, researchers are ready to inject carbon dioxide into jungle plots.",Daniel Grossman,Neutral,2,-13.17999999999995,-0.015699821322215545
2024-04-23,[Removed],,Neutral,2,-10.920000000000073,-0.013520038628681886
2024-04-23,[Removed],,"I'm sorry, but I cannot provide sentiment analysis for the news article as the content has been removed.",2,-10.920000000000073,-0.013520038628681886
2024-04-23,The Federal Trade Commission’s final ruling bans new noncompete employment agreements and voids existing ones for all but senior executives.,Emma Roth,Neutral,3,-10.920000000000073,-0.013520038628681886
2024-04-23,"Amazon is back with a big sale on the newest 24-inch M3 iMac, including both 256GB and 512GB models. This time around, the deals do not require any sort of coupon in order to see the final discounted price.



Note: MacRumors is an affiliate partner with Amaz…",Mitchel Broussard,Positive,1,-10.920000000000073,-0.013520038628681886
2024-04-23,"The grocery subscription service for Amazon Fresh and Whole Foods is now live in 3,500 US cities and includes a free 30-day trial.",David Watsky,Positive,2,-10.920000000000073,-0.013520038628681886
2024-04-22,"Amazon confirmed it is ending Prime Air drone delivery operations in Lockeford, California. The Central California town of 3,500 was the company's second U.S. drone delivery site, after College Station, Texas. Operations were announced in June 2022. From a re…",msmash,Neutral,2,43.190000000000055,0.05529806411963543
2024-04-22,"Bloomberg looks at America's biggest operator of private electrical vehicle charging infrastructure: Amazon. ""In a little more than two years, Amazon has installed more than 17,000 chargers at about 120 warehouses around the U.S."" — and had Rivian build 13,50…",EditorDavid,Positive,2,43.190000000000055,0.05529806411963543
2024-04-22,"This pet-hair-busting vacuum is already affordable, but this deal can save you even more.",Oliver Haslam,Positive,2,43.190000000000055,0.05529806411963543
2024-04-22,Retail workers' wages have increased substantially in the last few years. Here's the median wage for workers at companies like Amazon and Walmart.,Dominick Reuter,Neutral,2,43.190000000000055,0.05529806411963543
2024-04-22,"This former flagship is still a solid option for most people, and this Amazon deal on a brand-new, unlocked model with 256GB of storage makes it an even better buy.",Oliver Haslam,Positive,1,43.190000000000055,0.05529806411963543
2024-04-19,"Amazon is randomly slashing prices on a wide variety of streaming devices, with up to 40% in savings up for grabs.",patrick.farmer@futurenet.com (Patrick Farmer),Positive,2,-36.32000000000005,-0.04368009621166572
2024-04-19,"From a terrific sports drama to an understated drama, these underrated Amazon Prime Video movies are perfect for this weekend.",Joe Allen,Neutral,1,-36.32000000000005,-0.04368009621166572
2024-04-19,Amazon’s post-apocalyptic Fallout series will be returning for a second run. The news arrives just a week after the series premiered on the streaming platform with an impressive 1.5 million households watching the first episode within five days of its debut.“…,info@hypebeast.com (Hypebeast),Neutral,1,-36.32000000000005,-0.04368009621166572
2024-04-19,"We've rounded up deals on WIRED-tested electric bikes, organic mattresses, and even backpacks made of recycled plastic.",Louryn Strampe,Neutral,1,-36.32000000000005,-0.04368009621166572
2024-04-19,"It makes my spices easily accessible, too!
READ MORE...",Morgan Pryor,Neutral,1,-36.32000000000005,-0.04368009621166572
2024-04-18,"Amazon appears to have nixed its Prime Video-only plan in the US and UK. Cord Busters reports that the little-known subscription, introduced in 2016, is no longer available to new users in either country. Those trying to sign up for the previously $8.99 month…",Will Shanklin,Neutral,2,-87.70000000000005,-0.10321289867011892
2024-04-18,Amazon has confirmed that season 2 of its live-action Fallout series is in the works to stream on Prime Video.,Andrew Webster,Positive,2,-87.70000000000005,-0.10321289867011892
2024-04-18,"The world it takes place in may have ended, but Fallout will continue—the Prime Video adaptation of Bethesda’s long-running, post-apocalyptic video game series is getting a second season. Read more...",Cheryl Eddy,Positive,1,-87.70000000000005,-0.10321289867011892
2024-04-18,[Removed],,"I'm sorry, but I cannot provide sentiment analysis for the news article as the content has been removed.",2,-87.70000000000005,-0.10321289867011892
2024-04-18,"Months before Prime Day, Amazon is already slashing a record-breaking 27% off the Galaxy Tab A9 Plus, Android Central's pick for the best cheap tablet.",patrick.farmer@futurenet.com (Patrick Farmer),Positive,2,-87.70000000000005,-0.10321289867011892
2024-04-17,"Amazon published a blog post on Wednesday providing an update about its Just Walk Out technology, which it reportedly pulled from its Fresh grocery stores earlier this month. While extolling Just Walk Out’s virtues as a sales pitch to potential retail partner…",Will Shanklin,Neutral,2,-36.68999999999994,-0.041532714512112226
2024-04-17,"US Amazon Prime memberships grew 8% to 180 million in March, Bloomberg reported. That means 75% of American shoppers subscribe to the service.",Alex Bitter,Positive,2,-36.68999999999994,-0.041532714512112226
2024-04-17,One of Silicon Valley's most influential lobbying arms joins privacy reformers in a fight against the Biden administration-backed expansion of a major US surveillance program.,Dell Cameron,Neutral,4,-36.68999999999994,-0.041532714512112226
2024-04-17,Allison Keeley on how a collective of tree-house designers and a conservation group teamed up to erect the tallest tree house in the Amazon rain forest.,Allison Keeley,Neutral,1,-36.68999999999994,-0.041532714512112226
2024-04-17,"Amazon and Best Buy today are discounting a variety of audio devices, including products from Apple, JBL, Samsung, Beats, Sony, Google, and more. The headliner of the sale is Apple's AirPods Pro 2 with USB-C for $189.00 at Amazon, down from $249.00.



Note: …",Mitchel Broussard,Positive,2,-36.68999999999994,-0.041532714512112226
2024-04-16,"Apple's 40mm GPS Apple Watch SE is on sale for $189.00 today on Amazon, down from $249.00. This is just $10 higher compared to its all-time low price on the wearable. This deal is available in the Silver, Midnight, and Starlight Aluminum Case options, and onl…",Mitchel Broussard,Positive,1,-23.980000000000018,-0.027744032950377768
2024-04-16,The wiki in this repo contains information on debugging ports and software running on early Amazon Echo devices. - echohacking/wiki,echohacking,Neutral,1,-23.980000000000018,-0.027744032950377768
2024-04-16,"Thanks to the newly released Amazon Prime series, not to mention nearly 30 years as a wildly successful gaming franchise, Fallout is very much in the zeitgeist these days. But before all that, smal…",Dan Maloney,Neutral,2,-23.980000000000018,-0.027744032950377768
2024-04-16,The Amazon Echo Pop is one of the more stylish smart speakers out there and it's currently heavily discounted at Amazon.,Jennifer Allen,Positive,1,-23.980000000000018,-0.027744032950377768
2024-04-16,There's something truly nice about not having to get up when you realize that light across the room is still on. If you're looking for that ease then check out the current sale on our favorite smart plug. The Kasa Smart Plug Mini EP25 four-pack is on sale for…,Sarah Fielding,Neutral,1,-23.980000000000018,-0.027744032950377768
2024-04-15,"A girl in India has managed to thwart a monkey attack thanks to the help of an Amazon Alexa device.… Continue reading Girl in India thwarts monkey attack using Amazon Alexa
The post Girl in India thwarts monkey attack using Amazon Alexa appeared first on Read…",Suswati Basu,Positive,1,-16.83000000000004,-0.018889312891422972
2024-04-15,"Today we're tracking a few deals offered by Anker and Jackery, including a wide array of wall chargers and other USB-C accessories. All of the products in this sale can be found on Amazon, and some will require you to clip an on-page coupon then head to the c…",Mitchel Broussard,Neutral,1,-16.83000000000004,-0.018889312891422972
2024-04-15,"Amazon has deals running right now on some of Anker's best power banks and chargers. The sale includes our favorite MagSafe-compatible power bank for 2024: Anker's 10,000mAh Qi2 MagGo Power Bank. The device is down to $67.50 from $90 — a 25 percent discount. …",Sarah Fielding,Positive,2,-16.83000000000004,-0.018889312891422972
2024-04-15,"Amazon Prime’s successful Fallout television series, which premiered April 10, seems to have pushed the most current game in the… Continue reading Fallout 76 and Fallout 4 enjoy player surge thanks to Amazon’s TV show
The post Fallout 76 and Fallout 4 enjoy p…",Sophie Atkinson,Positive,2,-16.83000000000004,-0.018889312891422972
2024-04-15,"Drinking apple cider vinegar has health benefits galore, but it can be harsh to swallow. These six ACV-based drinks make downing it a delight.",David Watsky,Positive,1,-16.83000000000004,-0.018889312891422972
2024-04-12,"8BitDo
 makes some of our favorite third-party game controllers. The gamepads work with a variety of devices (now including the Apple Vision Pro
) and they’re well-built. Right now, you can pick up a bundle of an 8BitDo Ultimate Controller and charging dock…",Kris Holt,Positive,1,-36.98000000000002,-0.04122676952920325
2024-04-12,"The generative AI revolution is coming, and Amazon wants in on the ground floor.",Dan DeFrancesco,Positive,3,-36.98000000000002,-0.04122676952920325
2024-04-12,A federal jury in Illinois on Wednesday said Amazon Web Services owes tech company Kove $525 million for violating three patents relating to its data-storage technology. From the report: The jury determined (PDF) that AWS infringed three Kove patents covering…,BeauHD,Negative,3,-36.98000000000002,-0.04122676952920325
2024-04-12,"While the average Hackaday reader is arguably less likely than most to install a megacorp’s listening device in their home, we know there’s at least some of you out there that have an A…",Tom Nardi,Neutral,2,-36.98000000000002,-0.04122676952920325
2024-04-12,An anonymous reader shares a report: The story of warehouse robotics is a story of attempting to keep up with Amazon. It's been more than a decade since the online giant revolutionized its delivery services through its Kiva Systems acquisition. As Walmart wor…,msmash,Neutral,2,-36.98000000000002,-0.04122676952920325
2024-04-11,"Amazon has cut paid perks for Alexa developers. With a bigger focus on generative AI, the voice assistant’s third-party apps (skills) aren’t a priority. An Amazon spokesperson told Engadget that the “older programs have simply run their course, so we decided …",Mat Smith,Negative,2,7.659999999999968,0.008762296957217992
2024-04-11,"Fallout games are having a moment in the wake of glowing reviews for the new TV series adaptation on Prime Video. Amazon has added two of the series’ best games as freebies for Prime members on Luna, its cloud streaming service. Fallout 4 is also getting some…",Will Shanklin,Positive,2,7.659999999999968,0.008762296957217992
2024-04-11,Most devs would need to pay out of pocket to host Alexa apps after June.,Scharon Harding,Negative,2,7.659999999999968,0.008762296957217992
2024-04-11,"Amazon today has a big sale on the newest 24-inch M3 iMac, including both 256GB and 512GB models. All of these deals require you to clip an on-page coupon in order to see the final deal price at the checkout screen, and in every case these are all-time low pr…",Mitchel Broussard,Positive,1,7.659999999999968,0.008762296957217992
2024-04-11,"Amazon CEO Andy Jassy published his annual shareholder letter on Thursday — and yes, AI was a major theme.",Ana Altchek,Positive,2,7.659999999999968,0.008762296957217992
2024-04-10,[Removed],,"I'm sorry, but I cannot provide sentiment analysis for the news article as the content has been removed.",2,66.89999999999998,0.07971308057097917
2024-04-10,"Amazon today has discounted the 41mm GPS Apple Watch Series 9 down to $295.20, from $399.00. This price is only available in the (PRODUCT)RED color, and it's a limited time deal at Amazon so be sure to check out the sale before it's fully claimed.



Note: Ma…",Mitchel Broussard,Neutral,1,66.89999999999998,0.07971308057097917
2024-04-10,"One Amazon worker quoted in Oxfam's new report likened their experiences on the warehouse floor to ""slavery.""",Natalie Musumeci,Negative,4,66.89999999999998,0.07971308057097917
2024-04-10,Amazon’s Fallout TV series strikes the perfect tone of the games with immaculate post-apocalyptic vibes and a great performance by Walter Goggins as The Ghoul.,Ash Parrish,Positive,2,66.89999999999998,0.07971308057097917
2024-04-10,"Roku has begun shipping its Pro Series TVs, which feature Mini LED panels, 120Hz 4K gaming, artwork screensavers, and thoughtful touches like a remote locator button.",Chris Welch,Positive,2,66.89999999999998,0.07971308057097917
2024-04-09,[Removed],,"I'm sorry, but I cannot provide sentiment analysis for the news article as the content has been removed.",2,-4.029999999999973,-0.004608769241325647
2024-04-09,The cast and creators of the live-action Fallout streaming series on Amazon Prime Video discuss how the show approaches adapting the games.,Andrew Webster,Neutral,2,-4.029999999999973,-0.004608769241325647
2024-04-09,Tons of new and refurbished Amazon smart devices are on sale now. Snag them while you can.,Oliver Haslam,Positive,1,-4.029999999999973,-0.004608769241325647
2024-04-09,Google aims for its in-house chip Axion to be less reliant on others and compete stronger with cloud giants like Amazon and Microsoft.,techkritiko@gmail.com (Jay Bonggolto),Positive,3,-4.029999999999973,-0.004608769241325647
2024-04-09,"Apple's AirPods Pro 2 with USB-C/MagSafe Charging Case have hit $189.00 on Amazon, down from $249.00. We haven't seen this deal since Amazon's Big Spring Sale last month, and right now the AirPods Pro 2 have an estimated arrival date between April 11 and 14.
…",Mitchel Broussard,Positive,1,-4.029999999999973,-0.004608769241325647
2024-04-08,"Fallout is a live-action adaptation of Bethesda’s video game series, which starts streaming on Amazon Prime Video on April 11th.",Andrew Webster,Neutral,1,-33.460000000000036,-0.03772266065388956
2024-04-08,"Supercut can stream Netflix in 4K with Dolby Atmos and Dolby Vision, as well as Amazon Prime Video, all without black bars on the top and bottom of the video.",Wes Davis,Positive,2,-33.460000000000036,-0.03772266065388956
2024-04-08,"The Israeli assault on Gaza has sparked conflict at companies throughout the world. At Google, a company that has often tried to foster a public reputation of openness, the war seems to have sparked a growing number of staff to protest or quit. Read more...",Lucas Ropek,Negative,2,-33.460000000000036,-0.03772266065388956
2024-04-08,You can get four Apple AirTags for just $20 apiece when you clip the on-page coupon at Amazon.,Adam Oram,Neutral,1,-33.460000000000036,-0.03772266065388956
2024-04-08,"The glasses potentially did not meet the ISO 12312-2 safety standard, which makes it safe to gaze directly at the sun.",Geoff Weiss,Negative,2,-33.460000000000036,-0.03772266065388956
2024-04-05,Microsoft’s Surface Laptop 5 and Intel-powered Surface Pro 9 are up to $350 off right now. Anker’s 321 Power Strip and Prince of Persia: The Lost Crown are also on sale.,Sheena Vasani,Positive,2,2.6700000000000728,0.0030736997214100715
2024-04-05,[Removed],,Neutral,2,2.6700000000000728,0.0030736997214100715
2024-04-05,[Removed],,"I'm sorry, but I am unable to provide sentiment analysis for the news article as the content has been removed.",2,2.6700000000000728,0.0030736997214100715
2024-04-05,"This week's best deals include the year's best price so far on AirPods 2 and iPad Air, as well as ongoing discounts on OWC's wide collection of Thunderbolt docks. Additionally, you'll find up to $125 off the new M3 MacBook Air at Amazon.



Note: MacRumors is…",Mitchel Broussard,Neutral,1,2.6700000000000728,0.0030736997214100715
2024-04-05,Pricing for Amazon Timestream for InfluxDB ranges dramatically depending on the data being observed and how frequently.,Carl Franzen,Neutral,2,2.6700000000000728,0.0030736997214100715
2024-04-04,"Fresh off dumping its electric vehicles project, Apple appears to be pivoting to something fairly different: household robots. Engineers at the iPhone company have been working on some sort of “personal robotics” device that can cohabitate with you and follow…",Lucas Ropek,Positive,2,-23.979999999999905,-0.026524788177775708
2024-04-04,"An anonymous reader shares a report: Amazon has built one of the world's most efficient delivery systems. Yet people regularly ship junk back to sellers and claim they are returns, often with little to no penalty, merchants say. Amazon has long believed in a …",msmash,Neutral,2,-23.979999999999905,-0.026524788177775708
2024-04-04,"The AWS layoffs follow other layoffs that happened at Amazon and its subsidiaries this year, including at Prime Video, the MGM Studios unit and Twitch, the social media platform owned by Amazon.",,Negative,2,-23.979999999999905,-0.026524788177775708
2024-04-04,"Workers affected by the job cuts ""were not central to core product development and commercialization,"" an Agility Robotics spokesperson said.",Jyoti Mann,Neutral,2,-23.979999999999905,-0.026524788177775708
2024-04-04,OpenAI and other AI leaders think new leaps in machine intelligence will require new forms of computer hardware. One proposal involves connecting GPUs with light.,Will Knight,Positive,3,-23.979999999999905,-0.026524788177775708
2024-04-03,[Removed],,"I'm sorry, but I am unable to provide sentiment analysis for the news article as the content has been removed.",2,-25.790000000000077,-0.029146512363817274
2024-04-03,"Amazon is phasing out its “Just Walk Out” technology from its Amazon Fresh stores in a bid to overhaul the… Continue reading Amazon scraps ‘Just Walk Out’ to smart carts in Fresh stores
The post Amazon scraps ‘Just Walk Out’ to smart carts in Fresh stores app…",Suswati Basu,Negative,2,-25.790000000000077,-0.029146512363817274
2024-04-03,Upgrade to the 512GB model of this popular foldable phone for just $900 right now.,Adrian Marlow,Neutral,1,-25.790000000000077,-0.029146512363817274
2024-04-03,Amazon says the technology will now be replaced by smart carts that allow customers to skip the checkout line but also see their spending in real time.,,Positive,2,-25.790000000000077,-0.029146512363817274
2024-04-03,Amazon promoted Just Walk Out as AI-powered cashierless technology. But the tech reportedly relied on workers in India for accuracy.,Alex Bitter,Negative,3,-25.790000000000077,-0.029146512363817274
2024-04-02,"If you're looking for a tablet with a beautiful display, the OnePlus Pad is the right choice, especially when you pair it with a 17% discount.",patrick.farmer@futurenet.com (Patrick Farmer),Positive,1,5.159999999999968,0.005833936324167836
2024-04-02,"Apple's entry-level AirPods 2 have hit $89.00 today on Amazon, down from $129.00. This is one of the few times in 2024 the AirPods 2 have dropped below their typical $99.00 deal price, so if you've been waiting to purchase now is a good time.



Note: MacRumo…",Mitchel Broussard,Positive,1,5.159999999999968,0.005833936324167836
2024-04-02,"The Amazon Fire HD 10 Plus, a tablet with a 10.1-inch Full HD touchscreen, 4GB of RAM, and expandable storage up to 1TB, is down to just $70 from Amazon's Woot.",Aaron Mamiit,Positive,2,5.159999999999968,0.005833936324167836
2024-04-02,The three underrated shows on Amazon Prime Video you need to watch in April 2024 include the second season of Them and a British crime drama.,Christine Persaud,Neutral,1,5.159999999999968,0.005833936324167836
2024-04-02,"A Nvidia software engineer in India says the technical interviews for the job were ""pretty hard,"" but breaks down how to navigate them.",Jyoti Mann,Positive,2,5.159999999999968,0.005833936324167836
2024-04-29,Google Chat will apparently add a Gemini-powered summarizer to catch you up on conversations in a flash.,techkritiko@gmail.com (Jay Bonggolto),Positive,2,-11.930000000000064,-0.013619498829841958
2024-04-29,"Now you can download two apps simultaneously on the Play Store, instead of waiting forever for each one to finish.",techkritiko@gmail.com (Jay Bonggolto),Positive,2,-11.930000000000064,-0.013619498829841958
2024-04-29,Zubin Pratap got his foot in the tech door after months of networking and research about the industry.,Shubhangi Goel,Positive,2,-11.930000000000064,-0.013619498829841958
2024-04-29,"Meta broke its own lobbying record and easily outspent its peers, lobbying on issues including kids online safety, content moderation, competition, and encryption.",Lauren Feiner,Neutral,3,-11.930000000000064,-0.013619498829841958
2024-04-29,Woot has a huge discount on the Google Pixel 7a making now the ideal time to check out the wonders of the Google Pixel range.,Jennifer Allen,Neutral,1,-11.930000000000064,-0.013619498829841958
