Date,Description,Author,Sentiment,Severity,Stock_Price_difference,Stock_Price_Percentage_difference
2024-04-04,"The late jazz educator's own music is finally being heard, thanks to “Keep Swingin',” a joyful and wide-ranging 10-track album and book featuring Banacos’s compositions, photographs, and reminiscences from his students.",Noah Schaffer,Positive,1,-23.979999999999905,-0.026524788177775708
2024-04-04,"Kenny Smith has a new gig. 

Actually, two new gigs.","Adam Zagoria, Contributor, 
 Adam Zagoria, Contributor
 https://www.forbes.com/sites/adamzagoria/",Neutral,2,-23.979999999999905,-0.026524788177775708
2024-04-04,"If you are trying to replicate a virtual machine in Oracle VirtualBox, you have two options: Export and import to a separate computer or Create a clone. In this post, we will see how you can export, import, and clone Virtual Machine in VirtualBox.  Before you…",Yusuf@TWC,Neutral,1,-23.979999999999905,-0.026524788177775708
2024-04-03,"Security updates have been issued by Debian (py7zr), Fedora (biosig4c++ and podman), Oracle (kernel, kernel-container, and ruby:3.1), Red Hat (.NET 7.0, bind9.16, curl, expat, grafana, grafana-pcp, kernel, kernel-rt, kpatch-patch, less, opencryptoki, and post…",jzb,Neutral,2,-25.790000000000077,-0.029146512363817274
2024-04-03,Discontinued Software,,Neutral,2,-25.790000000000077,-0.029146512363817274
2024-04-03,Some other news outlets report a sale of Paramount Global’s voting shares to Skydance is not yet a done deal.,"Antonio Pequeño IV, Forbes Staff, 
 Antonio Pequeño IV, Forbes Staff
 https://www.forbes.com/sites/antoniopequenoiv/",Neutral,2,-25.790000000000077,-0.029146512363817274
2024-04-03,"Skydance boss David Ellison, the son of Oracle billionaire Larry Ellison, met with Paramount's independent board to discuss his vision for a deal, The New York Times reported late Tuesday.",Alexandra Steigrad,Neutral,2,-25.790000000000077,-0.029146512363817274
2024-04-03,"The deal would see David Ellison's company take control of the media conglomerate through the stake controlled by Shari Redstone's National Amusements
The post Paramount Global Stock Jumps Over 14% as Skydance Sets Exclusivity Window in Merger Talks appeared …",Lucas Manfredi,Neutral,2,-25.790000000000077,-0.029146512363817274
2024-04-02,"Google has committed to destroying or remediating ‘billions of data records’ collected through incognito browsing sessions as part of a… Continue reading Google will need to destroy incognito browsing data
The post Google will need to destroy incognito browsi…",Sophie Atkinson,Neutral,2,5.159999999999968,0.005833936324167836
2024-04-02,Some things stay constant in the IT environment: Java continues to be the fundamental coding language for enterprise development.,"Alexander Belokrylov, Forbes Councils Member, 
 Alexander Belokrylov, Forbes Councils Member
 https://www.forbes.com/sites/forbestechcouncil/people/alexanderbelokrylov/",Neutral,1,5.159999999999968,0.005833936324167836
2024-04-02,"Redis, a tremendously popular tool for storing data in-memory rather than in a database, recently switched its licensing from an open source BSD license to both a Source Available License and a Server Side Public License (SSPL). The software project and compa…",Thom Holwerda,Neutral,2,5.159999999999968,0.005833936324167836
2024-04-02,,,Neutral,1,5.159999999999968,0.005833936324167836
2024-04-02,The world’s wealthiest technology moguls have ridden the AI-fueled frenzy to never-before-seen heights.,"Phoebe Liu, Forbes Staff, 
 Phoebe Liu, Forbes Staff
 https://www.forbes.com/sites/phoebeliu/",Positive,3,5.159999999999968,0.005833936324167836
2024-04-29,"Different models of the Samsung QN800C QLED 8K TV and Samsung QN900C QLED 8K TV are available from Samsung with lowered prices, for discounts of up to $3,000.",Aaron Mamiit,Positive,2,-11.930000000000064,-0.013619498829841958
2024-04-29,"The Sennheiser Momentum 3 true wireless earbuds, which offer active noise cancellation, are on sale from Amazon's Woot for $120, but only for a limited time.",Aaron Mamiit,Positive,1,-11.930000000000064,-0.013619498829841958
2024-04-29,"Now you can download two apps simultaneously on the Play Store, instead of waiting forever for each one to finish.",techkritiko@gmail.com (Jay Bonggolto),Positive,2,-11.930000000000064,-0.013619498829841958
2024-04-29,"Samsung has reportedly had difficulties adapting its production line to the two-stack OLED needed for the new iPad Pro line, which is said to be the best OLED tablet panel on the market.Two 12.9-inch iPad Pro modelsThe forthcoming iPad launch on May 7, 2024, …",news@appleinsider.com (William Gallagher and Mike Wuerthele),Neutral,3,-11.930000000000064,-0.013619498829841958
2024-04-29,The Galaxy Tab S9 FE is now cheaper by $100,Chethan Rao,Neutral,1,-11.930000000000064,-0.013619498829841958
2024-04-26,It looks like Samsung pushed back the next camera upgrades for the Galaxy S24 Ultra.,techkritiko@gmail.com (Jay Bonggolto),Negative,2,39.3900000000001,0.046994678947242956
2024-04-26,"We'll have to wait and see what happens, but Samsung's Hon Pak has big plans for its Health ecosystem.",tips@androidcentral.com (Nickolas Diaz),Neutral,2,39.3900000000001,0.046994678947242956
2024-04-26,"The 57-inch Samsung Odyssey Neo G9 curved gaming monitor, which offers dual 4K Ultra HD resolution, is down to $1,800 from Samsung following a $700 discount.",Aaron Mamiit,Positive,2,39.3900000000001,0.046994678947242956
2024-04-26,The Galaxy Z Fold 6 and the Z Flip 6 are tipped to arrive earlier this year than the predecessor models.,vishnu.skar@gmail.com (Vishnu Sarangapurkar),Positive,2,39.3900000000001,0.046994678947242956
2024-04-26,"Google just shared some of the I/O schedule, and it includes a Wear OS 5 preview session. That's excellent news for the future of Wear OS.",bradypsnyder@gmail.com (Brady Snyder),Positive,2,39.3900000000001,0.046994678947242956
2024-04-25,"You can get discounts of up to $915 if you buy a smart range from Samsung's Spring Black Friday sale, but you need to hurry as the offers will likely end soon.",Aaron Mamiit,Positive,1,88.67000000000007,0.112428361312573
2024-04-25,It has been delayed until June,Rajesh Pandey,Negative,3,88.67000000000007,0.112428361312573
2024-04-25,"Samsung has launched a new 50W dual charger, but it might not be available for purchase in the US as it has only launched in Europe so far.
The post Samsung launches a new “super fast” 50W charger appeared first on Phandroid.",Tyler Lee,Neutral,2,88.67000000000007,0.112428361312573
2024-04-25,"CEO of X (Twitter), Linda Yaccarino teases what users can expect from its upcoming smart TV app.",tips@androidcentral.com (Nickolas Diaz),Neutral,2,88.67000000000007,0.112428361312573
2024-04-25,Samsung AI-powered wearable assistant helps visually impaired navigate better with real-time audio descriptionsNavigation and understanding of the environment is an everyday challenge for the visually impaired. This limitation hinders their independence and o…,Gaurav Sood,Positive,2,88.67000000000007,0.112428361312573
2024-04-24,Compare the Samsung Galaxy A35 and the Nothing Phone 2a side-by-side to help you decide. Get the easy-to-understand details about each phone to see which one is best for you.,judysanhz30@gmail.com (Judy Sanhz),Neutral,1,-13.17999999999995,-0.015699821322215545
2024-04-24,A report claimed that Google will upgrade and roll out version 2 of its Gemini Nano model on the Galaxy S25.,tips@androidcentral.com (Nickolas Diaz),Neutral,2,-13.17999999999995,-0.015699821322215545
2024-04-24,"The Honor Magic 6 Pro is the first phone with 4,320Hz PWM brightness adjustment, but does that automatically mean it's better for your eyes?",nicholas.sutrich@futurenet.com (Nicholas Sutrich),Neutral,2,-13.17999999999995,-0.015699821322215545
2024-04-24,Amazfit’s GTR 4 is currently down to $169.99 ($30 off) at multiple retailers. Anker’s Soundcore Sport X10 earbuds and Roborock’s Q Revo robot vacuum are also on sale.,Sheena Vasani,Positive,2,-13.17999999999995,-0.015699821322215545
2024-04-24,Samsung's The Frame TV is gorgeous to watch and simply look at. The 2022 model is currently on sale at Walmart right now.,Jennifer Allen,Neutral,1,-13.17999999999995,-0.015699821322215545
2024-04-23,Several Galaxy owners reported green line and display flickering issues after the April 2024 security update. They can now visit the service center for free replacement.,vishnu.skar@gmail.com (Vishnu Sarangapurkar),Negative,2,-10.920000000000073,-0.013520038628681886
2024-04-23,"New shades of familiar colors will come to the Galaxy Z Fold 6 and Galaxy Z Flip 6, and available storage configurations will be unchanged from this year's foldable lineup.",bradypsnyder@gmail.com (Brady Snyder),Neutral,1,-10.920000000000073,-0.013520038628681886
2024-04-23,"If you were hoping that all your cultish rituals and stuck voodoo dolls would make the iPhone FineWoven cases meet an untimely end, then you don’t know Apple. After one Apple tipster asserted that the maligned iPhone cases would soon be as dead as the Dodo, w…",Kyle Barr,Neutral,1,-10.920000000000073,-0.013520038628681886
2024-04-23,"Best Buy has quietly launched a massive sale on Android-friendly devices, so we've collected 10 of our favorite deals into this guide.",patrick.farmer@futurenet.com (Patrick Farmer),Neutral,1,-10.920000000000073,-0.013520038628681886
2024-04-23,"Apple, Samsung, and OnePlus could teach Google a thing or two",Rajesh Pandey,Neutral,2,-10.920000000000073,-0.013520038628681886
2024-04-22,The flagship Galaxy series under Samsung's Certified Re-newed program are coming to the U.S. starting as low as $619 for the standard Galaxy S23 model.,vishnu.skar@gmail.com (Vishnu Sarangapurkar),Positive,1,43.190000000000055,0.05529806411963543
2024-04-22,"Google and Samsung are launching an Android XR headset this year, but Meta has beaten them to the punch by making their own headset open-source, with partners like Lenovo and Microsoft joining the new Quest family.",michael.hicks@futurenet.com (Michael L Hicks),Positive,3,43.190000000000055,0.05529806411963543
2024-04-22,"Best Buy is currently slashing $150 off both storage configurations of the Galaxy S24 Plus, no strings attached.",patrick.farmer@futurenet.com (Patrick Farmer),Positive,1,43.190000000000055,0.05529806411963543
2024-04-22,A Galaxy Ring leak seems to have spilled the existence of several sizes on the way for launch.,tips@androidcentral.com (Nickolas Diaz),Neutral,2,43.190000000000055,0.05529806411963543
2024-04-22,"When your phone has hardware issues, where to get help depends on a few things.",jerry.hildenbrand@futurenet.com (Jerry Hildenbrand),Neutral,1,43.190000000000055,0.05529806411963543
2024-04-19,It's a tough choice between the Samsung Galaxy A35 and Google Pixel 7a if you're looking for an affordable mid-range phone.,christinep2424@gmail.com (Christine Persaud),Neutral,1,-36.32000000000005,-0.04368009621166572
2024-04-19,"The Galaxy A35 5G just hit store shelves on April 18th, and yet you can already find some major deals if you know where to look.",patrick.farmer@futurenet.com (Patrick Farmer),Neutral,1,-36.32000000000005,-0.04368009621166572
2024-04-19,"One could argue that Google just made its biggest announcement in years, as it formed a new ""Platforms and Devices"" division. I can't shake the feeling that the Google that we know and love will never be the same again.",andrew.myrick@futurenet.com (Andrew Myrick),Negative,2,-36.32000000000005,-0.04368009621166572
2024-04-19,"If you don't expect much, it's great",Jon Gilbert,Neutral,2,-36.32000000000005,-0.04368009621166572
2024-04-19,"A year and a half after Apple launched its Studio Display, Samsung released a direct competitor with its ViewFinity S9 5K monitor. With many of the same features as Studio Display plus some beyond, it’s an interesting alternative. Follow along for how Studio …",Michael Potuck,Positive,2,-36.32000000000005,-0.04368009621166572
2024-04-18,"Android phones include plenty of tools to help you tune out distracting notifications. It takes a little legwork to set it all up, but you’ll be glad you did in the end.",Allison Johnson,Neutral,1,-87.70000000000005,-0.10321289867011892
2024-04-18,"The Samsung Galaxy A35 5G is now out in the US, priced at $400.",techkritiko@gmail.com (Jay Bonggolto),Neutral,1,-87.70000000000005,-0.10321289867011892
2024-04-18,Samsung phones might finally get that app drawer update everyone's been waiting for.,techkritiko@gmail.com (Jay Bonggolto),Positive,2,-87.70000000000005,-0.10321289867011892
2024-04-18,"Samsung reportedly wasn't happy with its performance last year, so execs will be working Saturdays or Sundays.",Camilo Fonseca,Negative,2,-87.70000000000005,-0.10321289867011892
2024-04-18,"In honor of Earth Day, I have rounded up a set of the most prominent sustainable brands in the tech industry that actually make a difference.",namerah.saud-fatmi@futurenet.com (Namerah Saud Fatmi),Positive,1,-87.70000000000005,-0.10321289867011892
2024-04-17,"TVs might have gotten much less bulky in recent years, but most are still just big black screens. If you've been holding out for something a bit prettier, check out Amazon's sale on Samsung's QLED 4K The Frame LS03B Series. Most of the sizes are down to recor…",Sarah Fielding,Neutral,1,-36.68999999999994,-0.041532714512112226
2024-04-17,"If you're looking for a budget phone in the $300 range, the Samsung Galaxy A25 and Moto G Power 5G 2024 are two options worth considering, though they each have drawbacks.",christinep2424@gmail.com (Christine Persaud),Neutral,1,-36.68999999999994,-0.041532714512112226
2024-04-17,"Major brands like Samsung, iRobot and others are offering huge discounts on popular robot vacuum models. So, kick up your feet and let the robots do all the cleaning.",CNET Commerce,Positive,1,-36.68999999999994,-0.041532714512112226
2024-04-17,Android fans can bag this 11-inch tablet with a massive $60 saving for a limited time.,Oliver Haslam,Positive,1,-36.68999999999994,-0.041532714512112226
2024-04-17,The YouTube VR app on the Meta Quest just got another big update to support 8K resolution videos.,nicholas.sutrich@futurenet.com (Nicholas Sutrich),Positive,2,-36.68999999999994,-0.041532714512112226
2024-04-16,"The latest charts from analysts at IDC show Samsung has reclaimed the top spot on the global smartphone charts for the first quarter of the year, knocking Apple down to number two. Apple was dominating the charts for a brief second. But now, Samsung has the l…",Florence Ion,Neutral,2,-23.980000000000018,-0.027744032950377768
2024-04-16,The smartphone market is booming as Samsung snatches the top spot back from Apple.,techkritiko@gmail.com (Jay Bonggolto),Neutral,2,-23.980000000000018,-0.027744032950377768
2024-04-16,OnePlus' upcoming foldable phone might have what the Samsung Galaxy Z Flip lacks.,techkritiko@gmail.com (Jay Bonggolto),Positive,2,-23.980000000000018,-0.027744032950377768
2024-04-16,Apple is no longer the undisputed top dog of the smartphone wars. Meet the companies trying to eat its lunch.,Camilo Fonseca,Neutral,2,-23.980000000000018,-0.027744032950377768
2024-04-16,There's something truly nice about not having to get up when you realize that light across the room is still on. If you're looking for that ease then check out the current sale on our favorite smart plug. The Kasa Smart Plug Mini EP25 four-pack is on sale for…,Sarah Fielding,Positive,1,-23.980000000000018,-0.027744032950377768
2024-04-15,"After the largest decline in iPhone sales since the Covid-19 lockdowns, Samsung has reclaimed the top spot. Apple lost its… Continue reading Samsung reclaims top spot as iPhone sales plunge dramatically
The post Samsung reclaims top spot as iPhone sales plung…",Suswati Basu,Negative,3,-16.83000000000004,-0.018889312891422972
2024-04-15,"Samsung shipped the most smartphones in the first three months of the year, according to a new report.",Shubhangi Goel,Positive,2,-16.83000000000004,-0.018889312891422972
2024-04-15,"Apple's iPhone shipments decreased by nearly 10% globally in the first quarter of 2024, hit by rapid growth in shipments by rival Chinese vendors, based on data provided by the International Data Corporation (IDC). 





According to the IDC report, Apple's s…",Tim Hardwick,Negative,3,-16.83000000000004,-0.018889312891422972
2024-04-15,"Aside from the Google Pixel 9 series, the satellite connectivity feature to venture in the next Fold phone and an unknown tablet.",vishnu.skar@gmail.com (Vishnu Sarangapurkar),Neutral,2,-16.83000000000004,-0.018889312891422972
2024-04-15,"The 42mm and 46mm sizes of the Samsung Galaxy Watch 4 Classic with Bluetooth are available from Walmart with discounts, for prices that go as low as just $99.",Aaron Mamiit,Positive,2,-16.83000000000004,-0.018889312891422972
2024-04-12,"Samsung confirmed that Galaxy AI will arrive on more devices, but there will be sacrifices.",tips@androidcentral.com (Nickolas Diaz),Neutral,2,-36.98000000000002,-0.04122676952920325
2024-04-12,Walmart has $100 off the gorgeous Samsung 27-inch G65B curved gaming monitor which is perfect for immersive gaming.,Jennifer Allen,Positive,1,-36.98000000000002,-0.04122676952920325
2024-04-12,"Best Buy is currently slashing $150 off the Moto G Stylus 5G (2023), a midrange masterpiece that features a built-in stylus and some great-for-the-price specs.",patrick.farmer@futurenet.com (Patrick Farmer),Positive,1,-36.98000000000002,-0.04122676952920325
2024-04-12,"The Samsung Odyssey OLED G9 has a massive 49-inch curved display, a 240Hz refresh rate, and all the specs you need to get the most out of your gaming PC. Right now, you can get that monitor for its best price ever.",sendicott47@outlook.com (Sean Endicott),Positive,2,-36.98000000000002,-0.04122676952920325
2024-04-12,The One UI 6.1 update will arrive for Samsung’s 2022 flagships in early May,Rajesh Pandey,Neutral,1,-36.98000000000002,-0.04122676952920325
2024-04-11,"A smartwatch is so much more than a ""second screen"" for your phone. Get the most out of it with our Bluetooth pairing ""How-to!""",klpmediallc@gmail.com (Tshaka Armstrong),Neutral,1,7.659999999999968,0.008762296957217992
2024-04-11,"The company also teases its AI software will arrive on more devices ""soon.""",tips@androidcentral.com (Nickolas Diaz),Positive,2,7.659999999999968,0.008762296957217992
2024-04-11,The Galaxy S24 Ultra is a fantastic phone in its own right. There's just one issue — it isn't as interesting as its Chinese rivals.,harish.jonnalagadda@futurenet.com (Harish Jonnalagadda),Neutral,2,7.659999999999968,0.008762296957217992
2024-04-11,"I've got the new Samsung Galaxy A55 in my hand, ready for review. Even at this stage, there are some things that need to be said about it.",Andy Boxall,Neutral,1,7.659999999999968,0.008762296957217992
2024-04-11,"Usually in the size of traditional rings, smart rings are designed to track sleep and fitness and are rapidly gaining popularity. With many new players entering the market, smart rings are emerging as a powerful tool to monitor health and enhance various aspe…",nandika.iyerravi@futurenet.com (Nandika Ravi),Neutral,1,7.659999999999968,0.008762296957217992
2024-04-10,"If you purchase one of its new 2024 TV models by April 11, Samsung will throw in a free Crystal UHD for free.",Adrian Marlow,Positive,1,66.89999999999998,0.07971308057097917
2024-04-10,"Android 15 is on the horizon, and I'm banking on Google making audio-sharing accessible to all.",namerah.saud-fatmi@futurenet.com (Namerah Saud Fatmi),Neutral,2,66.89999999999998,0.07971308057097917
2024-04-10,"Roku has begun shipping its Pro Series TVs, which feature Mini LED panels, 120Hz 4K gaming, artwork screensavers, and thoughtful touches like a remote locator button.",Chris Welch,Positive,2,66.89999999999998,0.07971308057097917
2024-04-10,Samsung is updating Galaxy AI with seven new languages and five dialects,Jay Bonggolto,Positive,2,66.89999999999998,0.07971308057097917
2024-04-10,"The Galaxy S20 looks set to get security patches past its promised support timeline, Samsung help document suggests",Rajesh Pandey,Positive,2,66.89999999999998,0.07971308057097917
2024-04-09,"Samsung has refreshed its cheaper Android tablet this year, after launching it back in 2022.",vishnu.skar@gmail.com (Vishnu Sarangapurkar),Neutral,1,-4.029999999999973,-0.004608769241325647
2024-04-09,"With Dual Audio on your Galaxy phone, you can share your music with others by following a few simple steps. But does the feature work with all Samsung devices?",judysanhz30@gmail.com (Judy Sanhz),Neutral,1,-4.029999999999973,-0.004608769241325647
2024-04-09,"The Biden administration plans to announce it is awarding more than $6 billion to South Korea's Samsung next week to expand its chip output in Taylor, Texas, as it seeks to ramp up chipmaking in the U.S., Reuters reported Tuesday, citing sources. From the rep…",msmash,Positive,3,-4.029999999999973,-0.004608769241325647
2024-04-09,"The Samsung Bespoke AI Laundry Combo, powered by artificial intelligence for the best possible wash and dry every cycle, is on sale from Samsung at $1,140 off.",Aaron Mamiit,Positive,1,-4.029999999999973,-0.004608769241325647
2024-04-09,"If you preorder the 2024 model of the 65-inch Samsung The Frame QLED 4K TV for $2,000, you'll get the 65-inch Samsung TU690T 4K TV that's worth $530 for free.",Aaron Mamiit,Positive,1,-4.029999999999973,-0.004608769241325647
2024-04-08,"Samsung is ramping up its activity in the PC sector with its All-In-One desktop now launched in the company’s native… Continue reading Samsung launches All-In-One Pro PC with 4K screen
The post Samsung launches All-In-One Pro PC with 4K screen appeared first …",Sophie Atkinson,Positive,2,-33.460000000000036,-0.03772266065388956
2024-04-08,Bundle the purchase of the new Samsung Galaxy A15 5G with an eligible Straight Talk wireless plan and you'll get the phone for just under a Benjamin.,patrick.farmer@futurenet.com (Patrick Farmer),Positive,1,-33.460000000000036,-0.03772266065388956
2024-04-08,"Samsung has kicked off a new monitor sale, part of its ""High Resolution Week,"" which is set to run through the end of the week. During this event you'll find discounts on 4K and 5K Samsung monitors, including the popular ViewFinity S9 5K Smart Monitor and Sma…",Mitchel Broussard,Positive,2,-33.460000000000036,-0.03772266065388956
2024-04-08,"The Galaxy A25 is a year newer, but the A54 still packs a punch",Zachary Kew-Denniss,Neutral,2,-33.460000000000036,-0.03772266065388956
2024-04-08,"It's not flashy, but the A15 gets the job done for people who don't read reviews or care about specs",Stephen Radochia,Neutral,2,-33.460000000000036,-0.03772266065388956
2024-04-05,[Removed],,"I'm sorry, but I cannot provide sentiment analysis for the news article as the content has been removed.",2,2.6700000000000728,0.0030736997214100715
2024-04-05,"After seeing Samsung roll out an update for all of its devices, at the same time, it made me realize that Google's not in charge any longer. Samsung will continue to lead the way, and it might be too late for Google to do anything about it.",andrew.myrick@futurenet.com (Andrew Myrick),Negative,2,2.6700000000000728,0.0030736997214100715
2024-04-05,"Samsung Electronics is expecting to record a whopping 931% increase in first-quarter operating profit thanks to a firm rebound in… Continue reading Samsung operating profit boom after chip prices rebound
The post Samsung operating profit boom after chip price…",Graeme Hanna,Positive,2,2.6700000000000728,0.0030736997214100715
2024-04-05,"Apple decided to stop building cars and smartwatch displays in-house so it laid off 600 employees, according to a report from Bloomberg Thursday. The layoffs, which occurred in Feb. and March, affected 87 employees working at a secret Apple facility working o…",Maxwell Zeff,Negative,2,2.6700000000000728,0.0030736997214100715
2024-04-05,Are you thinking about picking up a Samsung Galaxy S24? Stop! Consider getting these alternatives instead.,Christine Romero-Chan,Neutral,2,2.6700000000000728,0.0030736997214100715
2024-04-04,"Roland Quandt (@rquandt) was one of the first leakers to claim the upcoming release of the Samsung Galaxy Buds 3 Pro. His brief tweet doesn’t include any details, though. In fact, he adds, “I have no idea when, what, how, this that, anything but the fact they…",Dua Rashid,Neutral,1,-23.979999999999905,-0.026524788177775708
2024-04-04,Samsung has reportedly decided on a supplier for Galaxy S24 FE components with rumors on its potential launch window.,tips@androidcentral.com (Nickolas Diaz),Neutral,2,-23.979999999999905,-0.026524788177775708
2024-04-04,"The Samsung Galaxy S24 has some really cool AI features, but they're not all enabled by default.",Nelson Aguilar,Neutral,2,-23.979999999999905,-0.026524788177775708
2024-04-04,Samsung is giving away free 65-inch smart TVs to anyone who preorders one of the new 2024 models before April 11th.,patrick.farmer@futurenet.com (Patrick Farmer),Positive,1,-23.979999999999905,-0.026524788177775708
2024-04-04,The Samsung Galaxy S24 features a three-camera system and performance that set it apart from competing flagship Android phones.,Antonio Villas-Boas,Positive,2,-23.979999999999905,-0.026524788177775708
2024-04-03,[Removed],,Neutral,2,-25.790000000000077,-0.029146512363817274
2024-04-03,"Everything in your home could soon heavily feature artificial intelligence if you want it to, as Samsung has today (April… Continue reading Samsung launches AI home appliance lineup
The post Samsung launches AI home appliance lineup appeared first on ReadWrit…",Sophie Atkinson,Positive,2,-25.790000000000077,-0.029146512363817274
